{
  "$schema": "https://json-schema.org/draft/2020-12/schema",
  "$id": "https://housamo-embed-trans.local/schema/scene-context.json",
  "title": "Housamo Embed Trans scene context",
  "type": "object",
  "required": [
    "version",
    "id",
    "storage_name",
    "display_name",
    "revision",
    "created_at",
    "updated_at",
    "manual_descriptions",
    "summary",
    "scenes"
  ],
  "properties": {
    "version": { "const": 1 },
    "id": { "$ref": "#/$defs/id" },
    "storage_name": { "$ref": "#/$defs/storageName" },
    "display_name": { "type": "string", "minLength": 1, "maxLength": 200 },
    "revision": { "type": "integer", "minimum": 1 },
    "created_at": { "type": "integer", "minimum": 0 },
    "updated_at": { "type": "integer", "minimum": 0 },
    "retention": {
      "type": "object",
      "required": ["inherit_defaults", "recent_percent", "recent_limit"],
      "properties": {
        "inherit_defaults": { "type": "boolean" },
        "recent_percent": { "type": "integer", "minimum": 1, "maximum": 100 },
        "recent_limit": { "type": "integer", "minimum": 1, "maximum": 10000 }
      },
      "additionalProperties": false
    },
    "manual_descriptions": { "$ref": "#/$defs/languageTextMap" },
    "summary": { "$ref": "#/$defs/summaryContainer" },
    "internal_terms": {
      "type": "object",
      "propertyNames": { "type": "string", "minLength": 1, "maxLength": 64 },
      "additionalProperties": {
        "type": "object",
        "propertyNames": { "type": "string", "minLength": 1 },
        "additionalProperties": { "type": "string", "minLength": 1 }
      }
    },
    "scenes": {
      "type": "array",
      "items": { "$ref": "#/$defs/sceneEntry" }
    }
  },
  "additionalProperties": false,
  "$defs": {
    "id": {
      "type": "string",
      "minLength": 1,
      "maxLength": 80,
      "pattern": "^[A-Za-z0-9][A-Za-z0-9_-]*$"
    },
    "storageName": {
      "type": "string",
      "minLength": 1,
      "maxLength": 64,
      "pattern": "^[A-Za-z][A-Za-z0-9_-]*$"
    },
    "languageText": {
      "type": "object",
      "required": ["text", "updated_at"],
      "properties": {
        "text": { "type": "string", "minLength": 1 },
        "updated_at": { "type": "integer", "minimum": 0 }
      },
      "additionalProperties": false
    },
    "languageTextMap": {
      "type": "object",
      "propertyNames": { "type": "string", "minLength": 1, "maxLength": 64 },
      "additionalProperties": { "$ref": "#/$defs/languageText" }
    },
    "summaryContainer": {
      "type": "object",
      "propertyNames": { "type": "string", "minLength": 1, "maxLength": 64 },
      "additionalProperties": { "$ref": "#/$defs/summaryLanguage" }
    },
    "summaryLanguage": {
      "type": "object",
      "minProperties": 1,
      "properties": {
        "final": { "$ref": "#/$defs/finalSummary" },
        "current": { "$ref": "#/$defs/currentSummary" },
        "manual": { "$ref": "#/$defs/manualSummary" }
      },
      "additionalProperties": false
    },
    "finalSummary": {
      "type": "object",
      "required": ["text", "source_hash", "updated_at"],
      "properties": {
        "text": { "type": "string", "minLength": 1 },
        "source_hash": { "type": "string", "minLength": 1 },
        "updated_at": { "type": "integer", "minimum": 0 }
      },
      "additionalProperties": false
    },
    "currentSummary": {
      "type": "object",
      "required": ["text", "source_hash", "updated_at", "cutoff"],
      "properties": {
        "text": { "type": "string", "minLength": 1 },
        "source_hash": { "type": "string", "minLength": 1 },
        "updated_at": { "type": "integer", "minimum": 0 },
        "cutoff": { "$ref": "#/$defs/id" }
      },
      "additionalProperties": false
    },
    "manualSummary": {
      "type": "object",
      "required": ["text", "updated_at"],
      "properties": {
        "text": { "type": "string", "minLength": 1 },
        "updated_at": { "type": "integer", "minimum": 0 }
      },
      "additionalProperties": false
    },
    "sceneEntry": {
      "type": "object",
      "required": [
        "entry_id",
        "scene",
        "scene_file",
        "created_at",
        "updated_at",
        "summaries"
      ],
      "properties": {
        "entry_id": { "$ref": "#/$defs/id" },
        "scene": { "type": "string", "minLength": 1, "maxLength": 200 },
        "scene_file": { "type": "string", "minLength": 1, "maxLength": 240 },
        "created_at": { "type": "integer", "minimum": 0 },
        "updated_at": { "type": "integer", "minimum": 0 },
        "summaries": { "$ref": "#/$defs/languageTextMap" }
      },
      "additionalProperties": false
    }
  }
}
