{
  "version": 1,
  "id": "90a916f4-ea13-5bc6-b4d9-097587f5567c",
  "storage_name": "main_story_chapter_01",
  "display_name": "主线第1章",
  "revision": 3,
  "created_at": 1790077145960,
  "updated_at": 1790122970136,
  "retention": {
    "inherit_defaults": true,
    "recent_percent": 30,
    "recent_limit": 10
  },
  "manual_descriptions": {},
  "summary": {
    "zh-cn": {
      "manual": {
        "text": "失忆的主人公被召到存在二十三处异界之门的东京，在新宿中央公园获得使魔沙罗门的引导，与药师丸良太互相救援，并召出拥有“离断”权能的剑形神器“铁刀迭尾”。战胜赤鬼后，主人公与其缔约成为伙伴。主人公的召唤者及返乡条件仍不明，同形召唤纹成为寻找召唤者的线索。经良太结识志朗、健吾后，主人公进入神宿学园；物部老师持有已签名的转校和监护文件，接纳其入住学生宿舍。新建立的同伴关系使主人公获得落脚处，而其罕见的“离断”与“全”属性已引起池袋公会以及六本木方面关注。",
        "updated_at": 1790122970136
      }
    }
  },
  "scenes": [
    {
      "entry_id": "8aa08002-dee7-53ff-a5aa-111158e3c2e0",
      "scene": "quest_main1-1",
      "scene_file": "quest_main1-1.json",
      "created_at": 1790077145960,
      "updated_at": 1790077342889,
      "summaries": {
        "zh-cn": {
          "text": "失去记忆的主人公在一道闪光后出现在新宿中央公园，只记得自己的名字，并持有装着召唤应用的手机。使魔沙罗门现身，解释主人公既是被某人召来的存在，也具有召唤师资格。遭落单赤鬼追赶的神宿学园学生药师丸良太与主人公相遇；两人先后冒险救援对方，主人公拒绝独自逃走。危急时，在沙罗门协助下，主人公以“流者”的职责和“离断”的权能召出剑形神器“铁刀迭尾”，击败赤鬼，并主动与其缔约，使之成为可召唤的伙伴。沙罗门惊讶于主人公能切断赤鬼与当地地脉的联系，但尚不能解释神器的来历。获救的良太报上姓名，带主人公离开公园。",
          "updated_at": 1790077342889
        }
      }
    },
    {
      "entry_id": "838d2d91-4e98-5158-b269-73a9b931cd3d",
      "scene": "quest_main1-2",
      "scene_file": "quest_main1-2.json",
      "created_at": 1790077145960,
      "updated_at": 1790077342889,
      "summaries": {
        "zh-cn": {
          "text": "良太向主人公介绍东京二十三处“门”与来自异界的转光生。沙罗门指出这里是不同于主人公故乡的世界，按召唤契约完成条件才可能回去；由于召唤者不明，只能以双方接触时浮现的同形召唤纹作为寻找线索，主人公手背现有的星形纹则属于与剑的契约。两人击退另一批落单转光生后离开公园，结识来催促归寝的本居志朗与高伏健吾，交换SUMMONS应用联络方式。志朗见主人公受伤且无处可去，邀请其到神宿学园。特里同、仁两位教师把主人公认作预定的转校生；物部匡真出示已有本人签名的入学及监护文件，愿作为家人照顾失忆的主人公，安排其入住第一学生宿舍。与此同时，丰岛区的狮子执事雪狮向红发主人报告新宿战斗：陌生人拥有“离断”权能和“全”属性。池袋公会决定迎接这名稀有来客，并得知六本木可能也已掌握消息。",
          "updated_at": 1790077342889
        }
      }
    }
  ]
}
