{
  "version": 1,
  "id": "e6eb5418-a35c-58b4-99c1-7a8e0b756bb9",
  "storage_name": "main_story_chapter_05",
  "display_name": "主线第5章",
  "revision": 2,
  "created_at": 1790077145960,
  "updated_at": 1790079611055,
  "retention": {
    "inherit_defaults": true,
    "recent_percent": 30,
    "recent_limit": 10
  },
  "manual_descriptions": {},
  "summary": {
    "zh-cn": {
      "manual": {
        "text": "召唤师公会为支付据点费用，接受克劳德的委托，潜入以财富与出身划分阶级的六本木东京赌场。主人公结识为帮助信晴而陷入赌债的伊夫利特，得知白面以神器作弊夺走他的心脏，便在克劳德支持下挑战白面。白面利用无穷援军和支配权能设局，两人却借离断与调包钥匙脱困。与此同时，俄菲翁和路基弗凯发动袭击，黑衣人偶制造混乱，小太郎的忍者搬走资料并销毁证据。主人公一行取回心脏、救出冬治，与志朗会合后前往地下避难所，在良太和哈奴曼帮助下见到撒托古亚。撒托古亚越过封闭领域限制，将众人直接送回地面，使六本木的支配者确认旧支配者拥有特殊的空间权能，并谋划据此接近GM。克劳德安排撒托古亚住进召唤师据点；即使志朗指出这会招来六本木的追兵，主人公仍决定保护朋友。白面在失败后受到赫洛特邀请，里希特也开始筹划争夺六本木的实权，新的冲突尚未结束。",
        "updated_at": 1790079611055
      }
    }
  },
  "scenes": [
    {
      "entry_id": "1021ca61-d08e-50e4-84d6-5825eaf818ae",
      "scene": "quest_main_5-1",
      "scene_file": "quest_main_5-1.json",
      "created_at": 1790077145960,
      "updated_at": 1790079611055,
      "summaries": {
        "zh-cn": {
          "text": "青山事件后，召唤师公会面临据点租金和维护费不足的问题。安德瓦利介绍克劳德的委托：主人公以同伴兼护卫身份参加东京赌场晚会，志朗、健吾和良太则扮成工作人员潜入，报酬用于支付据点费用。克劳德希望主人公亲眼认识以财富和阶级支配六本木的势力。提前赴约的主人公遇到警卫威胁健太、犬神与巴杰斯特，出手阻止。",
          "updated_at": 1790079611055
        }
      }
    },
    {
      "entry_id": "fb659d96-272e-5094-afc8-b249de2e4225",
      "scene": "quest_main_5-2",
      "scene_file": "quest_main_5-2.json",
      "created_at": 1790077145960,
      "updated_at": 1790079611055,
      "summaries": {
        "zh-cn": {
          "text": "主人公击退警卫，得知六本木按财富和身份划分居民等级，巴杰斯特和健太这样的低阶层居民不得靠近赌场。警卫再次持枪赶来，尚未开启APP的枪击可能造成真实伤害。冬治出手制止，以协助警方调查为由对抗黑衣人；对方却利用APP战斗难以留下证据的特点继续围攻。主人公让巴杰斯特带健太离开，留下协助冬治。",
          "updated_at": 1790079611055
        }
      }
    },
    {
      "entry_id": "15327ea4-5cde-5f06-87dc-ad2e098b16e2",
      "scene": "quest_main_5-3",
      "scene_file": "quest_main_5-3.json",
      "created_at": 1790077145960,
      "updated_at": 1790079611055,
      "summaries": {
        "zh-cn": {
          "text": "黑衣人的增援不断赶来，克劳德与雪狮乘车到场，以贵宾身份制止冲突，并替主人公准备新衣。进入赌场后，主人公发现地下藏着模仿各异世界建造的街区，富裕居民居于其中，地面居民则受等级限制。克劳德关注的是地下深处未公开的区域。演奏者乾闼婆用藏币与迷惑感官的小把戏提醒主人公：这里的赌局并不保证公平。",
          "updated_at": 1790079611055
        }
      }
    },
    {
      "entry_id": "e86f603c-5e23-5a5e-a7d9-8b72870a665b",
      "scene": "quest_main_5-4",
      "scene_file": "quest_main_5-4.json",
      "created_at": 1790077145960,
      "updated_at": 1790079611055,
      "summaries": {
        "zh-cn": {
          "text": "克劳德要主人公隐藏身份，准备探查赌场最深处。赌场主人白面现身，对主人公产生兴趣，并安排伊夫利特担任专属服务生。伊夫利特厌恶他所认为软弱、狡猾的人类，却因赌博负债、心脏被扣而不得不工作，也坚持履行自己的约定。主人公愿意陪他去吃员工餐，两人的关系开始缓和。途中伊夫利特发现潜伏的忍者，双方交战。",
          "updated_at": 1790079611055
        }
      }
    },
    {
      "entry_id": "fb5db987-4502-53e3-ba4e-390a214fcb3b",
      "scene": "quest_main_5-5",
      "scene_file": "quest_main_5-5.json",
      "created_at": 1790077145960,
      "updated_at": 1790079611055,
      "summaries": {
        "zh-cn": {
          "text": "伊夫利特在战斗中替主人公挡下偷袭。忍者的正面骚乱实为佯攻，小太郎与哈奴曼趁机潜入；哈奴曼随后自行去厨房偷吃。主人公见到送货的信晴，得知其家中酒铺遭六本木势力骚扰，学业与社团梦想也受到影响，伊夫利特正是为了筹钱帮助他才去赌博。良太在厨房与哈奴曼相遇，未认出经过雪狮乔装的主人公。回到客房后，黑发女赌徒前来躲避追兵，黑衣人随即闯入。",
          "updated_at": 1790079611055
        }
      }
    },
    {
      "entry_id": "c5e96375-0e19-5f08-a586-25f3e7e5093a",
      "scene": "quest_main_5-6",
      "scene_file": "quest_main_5-6.json",
      "created_at": 1790077145960,
      "updated_at": 1790079611055,
      "summaries": {
        "zh-cn": {
          "text": "追来的黑衣人在战败后消失。女赌徒自称赫洛特，指出白面用使人丧失判断力的神器骗取伊夫利特的心脏，并透露宝库金钥匙的位置。伊夫利特去找白面对质，赫洛特则邀请主人公加入破坏APP游戏的同伴，解释神器能够带出旧主的部分记忆和经验，同时劝主人公不要信任克劳德。另一边，白面正拉拢克劳德除掉俄菲翁。主人公为夺回心脏向白面挑战，克劳德出资，白面以打倒她全部仆人为胜利条件接受赌局。",
          "updated_at": 1790079611055
        }
      }
    },
    {
      "entry_id": "875794e3-a799-58e8-816a-3148f846ccb8",
      "scene": "quest_main_5-7",
      "scene_file": "quest_main_5-7.json",
      "created_at": 1790077145960,
      "updated_at": 1790079611055,
      "summaries": {
        "zh-cn": {
          "text": "主人公与伊夫利特击败一批黑衣人后，白面继续投入援军，利用“全部仆人”的条件将赌局变成消耗战。她一边观察克劳德对主人公的关切，一边拒绝让主人公退出。两人逐渐力竭，白面才亲自加入，宣布打倒她也算获胜。主人公与伊夫利特决定抓住这个机会迎战。",
          "updated_at": 1790079611055
        }
      }
    },
    {
      "entry_id": "69af3cbb-832c-57b0-82c9-c2900d74e65e",
      "scene": "quest_main_5-8",
      "scene_file": "quest_main_5-8.json",
      "created_at": 1790077145960,
      "updated_at": 1790079611055,
      "summaries": {
        "zh-cn": {
          "text": "白面借人数优势耗尽两人的体力，再用九尾鞭支配主人公，将他们囚禁。主人公实际已用离断切开支配，并按沙罗门的计策，将贴金箔的假钥匙换给白面，真钥匙藏在嘴里。克劳德也以神器煽动白面的狂热，使她疏于察觉。赌场突然停电，受另一权能控制的黑衣人偶袭击宾客和白面的部下；忍者同时行动。主人公与伊夫利特逃向宝库，途中得到健吾援救，三人继续寻找心脏。",
          "updated_at": 1790079611055
        }
      }
    },
    {
      "entry_id": "e06f73e7-9304-5a27-8e9c-810b934a282d",
      "scene": "quest_main_5-9",
      "scene_file": "quest_main_5-9.json",
      "created_at": 1790077145960,
      "updated_at": 1790079611055,
      "summaries": {
        "zh-cn": {
          "text": "赫洛特准备迎接新同伴，俄菲翁则在地面组织包围赌场，命令雇佣兵抓捕逃出者。切人受到他的羞辱，巴杰斯特替切人解围。地下的主人公一行仍被黑衣人偶追击，建筑开始剧烈震动。志朗来电要求他们继续向地下走，并约定会合。抵达宝库时，三人撞见忍者搬运财宝，其中包括伊夫利特的心脏，于是出手夺回。",
          "updated_at": 1790079611055
        }
      }
    },
    {
      "entry_id": "3d828caf-1c3a-5f0a-ab5b-aa5cd3d73158",
      "scene": "quest_main_5-10",
      "scene_file": "quest_main_5-10.json",
      "created_at": 1790077145960,
      "updated_at": 1790079611055,
      "summaries": {
        "zh-cn": {
          "text": "冬治追击昔日共事的小太郎，指责他投靠六本木；小太郎则说明自己只是按报酬办事，并指出警方已被收买，孤立无援的冬治无法阻止销毁证据。小太郎脱身后抵达宝库，拿走伊夫利特的心脏，释放杀气迫使主人公一行退让。主人公坚持取回朋友的东西，健吾与伊夫利特也决定共同承担风险。小太郎最终归还心脏，让他们记下一份人情；主人公提出以救出冬治偿还。众人随即赶到筋疲力尽、正被枪口指着的冬治身边。",
          "updated_at": 1790079611055
        }
      }
    },
    {
      "entry_id": "c887d3d7-056d-5573-8b81-4994e2d512ce",
      "scene": "quest_main_5-11",
      "scene_file": "quest_main_5-11.json",
      "created_at": 1790077145960,
      "updated_at": 1790079611055,
      "summaries": {
        "zh-cn": {
          "text": "赌场地下开始崩塌，赫洛特向失去赌场的白面伸手，邀请她离开。主人公与伊夫利特订立临时契约，解除心脏封印，以烈焰清除黑衣人偶。健吾背起昏迷的冬治，众人在志朗使魔的引导下会合。志朗说明上层起火、通道受阻，地面也遭包围，因此准备前往最深处的避难所；良太同样正由新认识的朋友陪同前往那里。",
          "updated_at": 1790079611055
        }
      }
    },
    {
      "entry_id": "6f3919b7-323c-5c65-bd77-03cc3998720c",
      "scene": "quest_main_5-12",
      "scene_file": "quest_main_5-12.json",
      "created_at": 1790077145960,
      "updated_at": 1790079611055,
      "summaries": {
        "zh-cn": {
          "text": "众人下到公开的地下四十七层，又发现通往秘密第四十八层的阶梯。门后并非普通避难所，而是与旧支配者世界重叠的宇宙空间；沙罗门在入口处消失，众人失重漂浮。良太与哈奴曼赶来，后者以具有“到达”权能的伸缩长棒固定众人，并送他们前往撒托古亚的住处。地面上的俄菲翁与路基弗凯则谈及赌场最深处的封印，以及曾支配这颗星球的异世界。",
          "updated_at": 1790079611055
        }
      }
    },
    {
      "entry_id": "b5b55f6e-d7af-545e-9f1e-f72cefd08237",
      "scene": "quest_main_5-13",
      "scene_file": "quest_main_5-13.json",
      "created_at": 1790077145960,
      "updated_at": 1790079611055,
      "summaries": {
        "zh-cn": {
          "text": "撒托古亚接待众人，说明自己按与白面的约定负责保护避难者，并直接用神器将众人送回地面。俄菲翁与路基弗凯通过这次袭击确认：旧支配者的空间权能可以越过封闭领域限制；他们据此猜测其力量与门及GM有关，准备夺取撒托古亚的力量。克劳德找到众人，提出出资供养撒托古亚、让他住进召唤师据点。志朗看穿此举会把追兵引向他们，克劳德承认，主人公仍为保护救过自己的朋友接受委托。伊夫利特恢复自由，冬治休养后留信离去；志朗开始筹备应对六本木的进攻。秀一向克劳德交换赫洛特身份的情报，六本木会长里希特则与梅露辛准备趁俄菲翁得意时发动突袭。",
          "updated_at": 1790079611055
        }
      }
    }
  ]
}
