{
  "version": 1,
  "id": "702dec32-b9ee-4fc2-938f-d82a087db609",
  "storage_name": "context_3",
  "display_name": "10周年",
  "created_at": 1792858646237,
  "internal_terms": {
    "zh-cn": {
      "医多橋メディカルスクール": "医多桥医学院",
      "医多橋学園": "医多桥学园",
      "転光生検査センター": "转光生检查中心",
      "フーシャン": "胡仙",
      "ビシャモンテン": "毗沙门天",
      "物部キョウマ": "物部匡真",
      "東京": "东京"
    }
  },
  "retention": {
    "inherit_defaults": true,
    "recent_percent": 30,
    "recent_limit": 10
  },
  "manual_descriptions": {},
  "summary": {},
  "scenes": [
    {
      "entry_id": "d669876b-361f-4f0a-bd43-eb5895202843",
      "scene": "10thBefore_1-1",
      "scene_file": "10thBefore_1-1.json",
      "created_at": 1793194735146,
      "updated_at": 1793269718126,
      "summaries": {
        "zh-cn": {
          "text": "在关于世界序列与信仰防线的叙述后，板桥区一位留着胡子的社区医生正为缺人手而烦恼。另一边，主人公带着神宿学园新闻部的祝融来到依依祇学园出差，围观了群藏、球马等人的概念拍摄现场，并与峰明老师接洽。峰明送两人回神宿后，主人公在宿舍与同伴们聊起未来的出路。随后保健医神农前来寻找太三郎去办转光生登记手续，但太三郎忘带了文件。于是神农带太三郎去补办手续，并让自己的亲传弟子、实习护士胡仙带领主人公参观转光生检查中心。胡仙以哄婴儿的方式亲昵地照顾主人公，随后被那位社区医生的呼喊打断。",
          "updated_at": 1793269718126
        }
      }
    },
    {
      "entry_id": "a977f0f3-9e69-4871-b2d5-e81f21130e1e",
      "scene": "10thBefore_1-2",
      "scene_file": "10thBefore_1-2.json",
      "created_at": 1793194735211,
      "updated_at": 1793269718126,
      "summaries": {
        "zh-cn": {
          "text": "板桥区的社区医生毗沙门天曾是随宝船航行各界的战士，在不同世界以多闻天等名号为人所知，最终受板桥公会会长的感召而立志在东京行医。初次与主人公相遇时，他称主人公为天使并热情搭讪，引来胡仙的吐槽。就在胡仙与毗沙门天向主人公介绍转光生在东京的升学与就业机制时，紧急警报骤响，中心外出现了疑似外来物种的史莱姆。此时席兹抱着浑身发出彩虹光芒且腹痛难忍的良太赶来求助。毗沙门天与胡仙联手在封闭领域中压制外来物种。随后神农赶到，调查确认良太误食了神农收集的有毒植物，腹痛与外来物种事件无关。借助神农预先制成的抗体，两件事均得以解决。事后众人聚在一起，学生们纷纷向老师们提出升学与就职的咨询。",
          "updated_at": 1793269718126
        }
      }
    }
  ],
  "revision": 5,
  "updated_at": 1793269718126
}
