{
  "version": 1,
  "id": "83ec09e0-58d8-50bb-8fa2-1a4b4317d379",
  "storage_name": "main_story_chapter_02",
  "display_name": "主线第2章",
  "revision": 2,
  "created_at": 1790077145960,
  "updated_at": 1790078968443,
  "retention": {
    "inherit_defaults": true,
    "recent_percent": 30,
    "recent_limit": 10
  },
  "manual_descriptions": {},
  "summary": {
    "zh-cn": {
      "manual": {
        "text": "主人公入学后，志朗因学校附近的伤害案陷入恐慌。追寻他的过程中，主人公遭池袋公会成员袭击，又救下被恶魔反攻的追捕者，并发现“离断”能斩开召唤契约。志朗误以为自己初次注册APP时召出的恶魔造成了现实杀伤，无法控制神器“尸书五狂”；主人公与良太根据对战退出后伤势应当复原的规则，发现案件不能直接归罪于他。主人公赶去救援，与失控的志朗发生神器冲突，“开拓”与“离断”的矛盾触发例外，新宿开始崩坏。崎守冬治指导两人接触巨人，以亲吻召唤纹或嘴唇的仪式建立权能关系，终于恢复城市。志朗接受自己的力量及使魔，也加深了对主人公的信任。冬治暂缓收走APP，但警告两人不得作恶。现实残肢案尚未查明，池袋方面的鬼若与切人则开始谋划利用健吾接近两人。",
        "updated_at": 1790078542227
      }
    }
  },
  "scenes": [
    {
      "entry_id": "dfe3b18b-3e6d-5d50-b99d-68e9278e7045",
      "scene": "quest_main2-1",
      "scene_file": "quest_main2-1.json",
      "created_at": 1790077145960,
      "updated_at": 1790078542227,
      "summaries": {
        "zh-cn": {
          "text": "物部老师在课堂上介绍转光生与东京的共存制度，并因学校附近发现残肢和伤人痕迹宣布临时停课。主人公认识了与健吾一同修行的犬冢戍孝。志朗听到案件后脸色苍白，反复否认与自己有关，接到手机消息便匆忙离开。主人公与良太分头追寻，途中遭到鬼若手下的APP玩家围攻。沙罗门说明，APP会暴露玩家位置及所属，对战在封闭领域内进行；不战而逃会失去APP用户和召唤师资格，也会断掉主人公寻找返乡方法的线索。",
          "updated_at": 1790078542227
        }
      }
    },
    {
      "entry_id": "dd825545-abd1-5cd6-acc7-66128889ba09",
      "scene": "quest_main2-2",
      "scene_file": "quest_main2-2.json",
      "created_at": 1790077145960,
      "updated_at": 1790078542227,
      "summaries": {
        "zh-cn": {
          "text": "围攻主人公的学生召唤史莱姆，宣称APP玩家分为使用神器和驱使转光生的两类。主人公在持剑的同时召来已缔约的赤鬼，让对手大为惊慌。学生们召集其他同伙增援，却不敢通知鬼若，想在人多势众的情况下解决这个看似新手的对手。",
          "updated_at": 1790078542227
        }
      }
    },
    {
      "entry_id": "7ba9685a-d1f1-50b5-b75a-b4391755ab89",
      "scene": "quest_main2-3",
      "scene_file": "quest_main2-3.json",
      "created_at": 1790077145960,
      "updated_at": 1790078542227,
      "summaries": {
        "zh-cn": {
          "text": "池袋公会的火系兽人带队增援，训斥手下没有先查对手的神器属性，并说明五种属性的克制关系。众人随后发现主人公的属性竟是未见过的“全”，怀疑其就是鬼若寻找的“稀有种”。他们担心事情败露，仍不敢通知鬼若，决定一拥而上。",
          "updated_at": 1790078542227
        }
      }
    },
    {
      "entry_id": "5dc71e55-b7f8-5229-a8a6-89415abf6120",
      "scene": "quest_main2-4",
      "scene_file": "quest_main2-4.json",
      "created_at": 1790077145960,
      "updated_at": 1790078542227,
      "summaries": {
        "zh-cn": {
          "text": "主人公击败围攻者，得知鬼若命他们寻找“黑发戴眼镜的恶魔操纵者”，怀疑与志朗有关，便用APP追踪逃走的学生。学生们却遭一群恶魔袭击，手机也被夺走，无法退出对战。主人公不愿坐视，按沙罗门的说明加入受袭一方，进入封闭领域救援。",
          "updated_at": 1790078542227
        }
      }
    },
    {
      "entry_id": "aec6c50c-927f-5ac8-aacd-4a71ea538c5e",
      "scene": "quest_main2-5",
      "scene_file": "quest_main2-5.json",
      "created_at": 1790077145960,
      "updated_at": 1790078542227,
      "summaries": {
        "zh-cn": {
          "text": "沙罗门辨认出袭击者是其他玩家暂时召来的使魔，并非独立存在的落单转光生；召唤师可以躲在远处指挥，要停止攻击只能由其下令或打倒使魔。恶魔将主人公也视为主人的敌人，转而抢夺手机。沙罗门警告，主人公依靠APP施展召唤，手机及数据被毁会使神器匹配、召唤记录和返乡线索一并丢失。",
          "updated_at": 1790078542227
        }
      }
    },
    {
      "entry_id": "a7743faf-2848-5388-849c-f5671cb7b960",
      "scene": "quest_main2-6",
      "scene_file": "quest_main2-6.json",
      "created_at": 1790077145960,
      "updated_at": 1790078542227,
      "summaries": {
        "zh-cn": {
          "text": "恶魔不断增多，主人公试图寻找不必杀死它们的办法。沙罗门说明，这些使魔已有正式召唤契约，不能像失去召唤师的赤鬼那样直接重新缔约。他回想主人公曾改写赤鬼与地脉的联系，开始思考能否干涉契约支配；主人公手中的剑也逐渐发亮。",
          "updated_at": 1790078542227
        }
      }
    },
    {
      "entry_id": "1f08e082-dcdc-5e7f-9d60-29d740b2a917",
      "scene": "quest_main2-7",
      "scene_file": "quest_main2-7.json",
      "created_at": 1790077145960,
      "updated_at": 1790078542227,
      "summaries": {
        "zh-cn": {
          "text": "主人公用“离断”斩开召唤契约，使恶魔失去攻击力并结束对战。封闭领域解除后，受伤甚至死去的学生恢复原状，沙罗门说明正常结束APP对战会还原物理损伤，但痛苦和死亡的记忆仍会留下。学生因恐惧想退出，持刀青年却以鬼若的命令逼他们继续搜寻，对主人公也表现出敌意。主人公随后继续处理残余恶魔。",
          "updated_at": 1790078542227
        }
      }
    },
    {
      "entry_id": "fb47738b-aec2-52e8-ab60-cdc6039f015c",
      "scene": "quest_main2-8",
      "scene_file": "quest_main2-8.json",
      "created_at": 1790077145960,
      "updated_at": 1790078542227,
      "summaries": {
        "zh-cn": {
          "text": "被切断契约的恶魔首领将要消失，主人公伸出援手，与它重新缔约，并承诺帮助它痛苦中的旧主人。沙罗门提醒，使魔需要持续汲取召唤师的力量，不能随意增加契约。恶魔带主人公找到志朗：志朗正否认自己召唤了怪物，无法控制那些为保护他而攻击他人的使魔。恶魔将主人公视为威胁，志朗急忙叫其逃走，并在看见召出的剑时意识到双方拥有相似的力量。",
          "updated_at": 1790078542227
        }
      }
    },
    {
      "entry_id": "8816abb3-468d-5fa5-98e4-dcd0c9779338",
      "scene": "quest_main2-9",
      "scene_file": "quest_main2-9.json",
      "created_at": 1790077145960,
      "updated_at": 1790078542227,
      "summaries": {
        "zh-cn": {
          "text": "志朗讲述前夜经过：他在便利店附近完成APP注册，召出一本书，随后遭到“打菜鸟”的公会成员围攻。书中恶魔自动反击，造成断臂和血泊；志朗惊慌逃走，回宿舍后关闭APP，以为一切只是噩梦。学校通报的伤害案让他相信自己闯下大祸，追捕者又不断遭使魔袭击。他无法接受自己是召唤师，认定已经无处可归，在使魔的保护下再次逃离主人公。",
          "updated_at": 1790078542227
        }
      }
    },
    {
      "entry_id": "53f07997-e542-5e53-bc3f-77bcc04a4f91",
      "scene": "quest_main2-10",
      "scene_file": "quest_main2-10.json",
      "created_at": 1790077145960,
      "updated_at": 1790078542227,
      "summaries": {
        "zh-cn": {
          "text": "志朗退出APP后无法追踪，持刀青年再次警告主人公别袒护伤害公会成员的人。手机耗尽电量，主人公回校向物部老师借充电器。物部说明，他只收到匿名安排与已签名的担保文件，不知道委托者身份，但愿意保护每个学生。良太回来交换情报，两人发现志朗已经退出过APP，昨夜战斗的伤势本应复原，因此现实中留下残肢的案件不能直接归罪于他。良太借戍孝分散特里同的注意，自己拖住仁老师，让主人公再次出校寻找志朗。",
          "updated_at": 1790078542227
        }
      }
    },
    {
      "entry_id": "42cdc611-d329-5ffe-ac69-2f26b23dde17",
      "scene": "quest_main2-11",
      "scene_file": "quest_main2-11.json",
      "created_at": 1790077145960,
      "updated_at": 1790078542227,
      "summaries": {
        "zh-cn": {
          "text": "主人公找到陷入自责的志朗。他认定自己杀了人，既想回家又觉得已经无处可去，听不进解释。书中恶魔随着他的恐惧不断增殖，挡住靠近的道路，主人公只能继续战斗，设法接近他。",
          "updated_at": 1790078542227
        }
      }
    },
    {
      "entry_id": "2fc39ccc-d911-5659-9ade-aa9e112868aa",
      "scene": "quest_main2-12",
      "scene_file": "quest_main2-12.json",
      "created_at": 1790077145960,
      "updated_at": 1790078542227,
      "summaries": {
        "zh-cn": {
          "text": "志朗在绝望中把书当成唯一的伙伴，听从书的引导，想逃离眼前的一切。他以“看守”的天职和“开拓”的权能解放神器“尸书五狂”，主人公则以“流者”“离断”回应，召出“铁刀迭尾”，两件神器正面相撞。",
          "updated_at": 1790078542227
        }
      }
    },
    {
      "entry_id": "d90ebd15-0237-5b88-a071-23a5f2839e99",
      "scene": "quest_main2-13",
      "scene_file": "quest_main2-13.json",
      "created_at": 1790077145960,
      "updated_at": 1790078542227,
      "summaries": {
        "zh-cn": {
          "text": "主人公唤醒志朗，解释APP对战结束后会还原伤亡，使他放下对现实伤害案的自责，也开始理解恶魔是在保护自己。然而志朗准备退出时，新宿突然崩坏，巨大人形与圆形空间吞噬建筑和人群，沙罗门也失去联系。崎守冬治赶来阻止退出，说明“开拓”与“离断”相互矛盾，冲突使APP无法判定法则而触发例外处理；此时强制退出可能让灾害无法恢复。他以“天害孤毒”迎战事故产生的幽灵，带两人寻找补救办法。",
          "updated_at": 1790078542227
        }
      }
    },
    {
      "entry_id": "5b66936d-9d05-526b-ae75-4bcadeb3044e",
      "scene": "quest_main2-14",
      "scene_file": "quest_main2-14.json",
      "created_at": 1790077145960,
      "updated_at": 1790078542227,
      "summaries": {
        "zh-cn": {
          "text": "冬治说明自己的刀术来自崎守一族，只为介入APP事件才使用应用。他提出消除例外的方法：两名当事人接触巨人，确立相反权能间的从属关系，使APP恢复判定；再次决斗只会加深敌对与矛盾。仪式需要亲吻嘴唇或召唤纹等灵能部位，并建立力量供给关系。冬治负责引开敌人，主人公与志朗前往巨人处。志朗担心同学与家人已遭牵连，在主人公安慰下继续前进。",
          "updated_at": 1790078542227
        }
      }
    },
    {
      "entry_id": "29f55667-4574-5c1c-a3ba-061ff31f8b39",
      "scene": "quest_main2-15",
      "scene_file": "quest_main2-15.json",
      "created_at": 1790077145960,
      "updated_at": 1790078542227,
      "summaries": {
        "zh-cn": {
          "text": "两人接近巨人，志朗逐渐学会回应与安抚使魔，感谢它们一直保护自己，也担心主人公是否愿意完成仪式。巨人短暂看向两人后便移开视线，随意活动身体却已造成难以靠近的压力。面对悬殊的力量，志朗在主人公鼓励下决定一同闯过去。",
          "updated_at": 1790078542227
        }
      }
    },
    {
      "entry_id": "346fb605-a221-5b23-977c-9a7120abd637",
      "scene": "quest_main2-16",
      "scene_file": "quest_main2-16.json",
      "created_at": 1790077145960,
      "updated_at": 1790078968443,
      "summaries": {
        "zh-cn": {
          "text": "主人公与志朗顶着冲击与恐惧抵达巨人身边，合力挡下触手，在接触巨人的同时完成仪式。两人通过亲吻任一方的手背或接吻完成仪式，具体方式随选择而异。例外消失，新宿与受害者恢复，良太和老师来电催促返校。冬治因两人曾危及大量民众而要求回收手机，主人公拒绝，志朗也请求再给机会；冬治接获其他事件通知后暂且离开，警告他们不得滥用力量。志朗珍惜重新归来的日常，与主人公回校。另一边，切人向鬼若报告两人身份，鬼若决定利用与他们相识的高伏健吾，将目标一网打尽。",
          "updated_at": 1790078968443
        }
      }
    }
  ]
}
