{
  "version": 1,
  "id": "209b8771-2baf-5985-b7c9-f88bee23ba06",
  "storage_name": "main_story_chapter_03",
  "display_name": "主线第3章",
  "revision": 2,
  "created_at": 1790077145960,
  "updated_at": 1790078968443,
  "retention": {
    "inherit_defaults": true,
    "recent_percent": 30,
    "recent_limit": 10
  },
  "manual_descriptions": {},
  "summary": {
    "zh-cn": {
      "manual": {
        "text": "志朗与主人公赴池袋调查 APP，也想带回疏远朋友的健吾。主人公闯入地下格斗场、逐步升为排位者，结识加姆、巴钦、狼神神威、波鲁克斯等战士；志朗则与本乡公会的秀一交涉，查明有人操纵排名，以奖金和亲友威胁健吾。主人公通过决斗赢得健吾信任，再按志朗的计划拉拢安德瓦利与巴钦，救他脱离鬼若的控制。鬼若的“篡夺”与健吾的“无穷”冲突，引发例外，鬼若失控，雷电异形现身。主人公斩断鬼若的力量来源，与他结缘；三人建立临时公会，借契约与公会关系确定权能排序，在众战士协助下击倒异形、完成仪式，恢复池袋。健吾重拾友情与走出东京的愿望，志朗决定以参谋身份守护新公会。事件同时揭示：秀一等人将此作为例外观测实验，克劳德与雪狮也各有布局；主人公体内被不同转光生认出的灵魂，以及承受多重契约的能力，仍是谜团。",
        "updated_at": 1790078968443
      }
    }
  },
  "scenes": [
    {
      "entry_id": "970ea637-c66c-5e13-8f69-342d9923c494",
      "scene": "quest_main3-1",
      "scene_file": "quest_main3-1.json",
      "created_at": 1790077145960,
      "updated_at": 1790078968443,
      "summaries": {
        "zh-cn": {
          "text": "新宿事件后，志朗相信主人公来自异世界，并愿意帮其找回记忆。两人调查 SUMMONS 中尚未开放的公会功能，约好到池袋向志朗的网友请教。良太则去青山答谢此前帮忙寻人的朋友。志朗想起健吾惯常在假日去池袋打架，便带主人公提前出发，果然撞见他在街头击败一群兽人。志朗劝阻暴力行为，与不在乎退学的健吾争执起来。",
          "updated_at": 1790078968443
        }
      }
    },
    {
      "entry_id": "3b2c12ed-ad54-535f-8eb1-d639760ee826",
      "scene": "quest_main3-2",
      "scene_file": "quest_main3-2.json",
      "created_at": 1790077145960,
      "updated_at": 1790078968443,
      "summaries": {
        "zh-cn": {
          "text": "健吾殴打志朗，声称要退学并与朋友断绝关系。志朗不相信这是真心话，与主人公追查他的去向，使魔将两人引向一座改建为地下格斗场的剧院。守门的白狮管家雪狮要求来访者既有经认可的实力，也有战士引荐。志朗因畏惧鲜血而受到奚落，主人公为维护他与雪狮交战，试图争取入场资格。",
          "updated_at": 1790078968443
        }
      }
    },
    {
      "entry_id": "0059b1a7-e9f0-57cc-8329-06c4ff797d6e",
      "scene": "quest_main3-3",
      "scene_file": "quest_main3-3.json",
      "created_at": 1790077145960,
      "updated_at": 1790078968443,
      "summaries": {
        "zh-cn": {
          "text": "雪狮轻易避开使魔的围攻，虽认可主人公保护同伴的勇气，仍不允许无引荐者入场。他以“三体”发动吉翔螺旋，将主人公击倒。主人公醒来后得知志朗哭着求助，救人者正是网友“Cain”——东乡秀一，身旁还有弟弟迪欧。兄弟二人来自本乡公会“贤者”。秀一高声暴露己方身份，引来池袋公会成员围攻，迫使双方一同战斗，并使用能够征收思考的神器。",
          "updated_at": 1790078968443
        }
      }
    },
    {
      "entry_id": "f7c90756-f73e-55e5-a80c-b8588825cc5b",
      "scene": "quest_main3-4",
      "scene_file": "quest_main3-4.json",
      "created_at": 1790077145960,
      "updated_at": 1790078968443,
      "summaries": {
        "zh-cn": {
          "text": "众人按迪欧提供的路线脱身。志朗察觉秀一故意引发战斗，以神器读取自己与主人公的记忆；秀一承认另有所图，提出用健吾遭人设局的情报交换交谈机会，并邀请志朗加入贤者。志朗留下谈判，主人公则由秀一安排的向导戍孝带走。所谓安全等候的去处实际是地下格斗场，主人公为了见到健吾，与看守入口的加姆交手。",
          "updated_at": 1790078968443
        }
      }
    },
    {
      "entry_id": "e47e3af3-ef0d-505f-85a5-84ea4d8fb308",
      "scene": "quest_main3-5",
      "scene_file": "quest_main3-5.json",
      "created_at": 1790077145960,
      "updated_at": 1790078968443,
      "summaries": {
        "zh-cn": {
          "text": "主人公击败加姆，凭戍孝引荐获准入场。加姆从主人公身上闻到故乡与最初主人的气息，希望与其订立契约。雪狮提醒，维持转光生需要召唤师付出力量，与加姆这样的弑神武器立约，甚至可能大幅消耗寿命。入场后，恶魔巴钦热情接待主人公，说明前十名“排位者”拥有专用区域。要接近身为排位者的健吾，主人公必须参加比赛、提升名次，于是报名迎战。",
          "updated_at": 1790078968443
        }
      }
    },
    {
      "entry_id": "fe369d5c-fe44-54b8-9bea-5db9f06a46cc",
      "scene": "quest_main3-6",
      "scene_file": "quest_main3-6.json",
      "created_at": 1790077145960,
      "updated_at": 1790078968443,
      "summaries": {
        "zh-cn": {
          "text": "秀一向志朗解释公会需要会长与据点，攻陷据点或击败会长会使组织瓦解；池袋的地下设施与成员数量都是优势。另一边，主人公赢得首战。巴钦比起胜负更看重观众热情，说明恶魔依靠人类情感维持存在，契约能使这种联系更有效。主人公随后撞见摔跤手大介戴上面具、化身公牛假面的过程，对方因真实身份被看穿而慌张，要求以比赛解决。",
          "updated_at": 1790078968443
        }
      }
    },
    {
      "entry_id": "71781918-4056-5eb0-a6a3-c5f7fb2ac569",
      "scene": "quest_main3-7",
      "scene_file": "quest_main3-7.json",
      "created_at": 1790077145960,
      "updated_at": 1790078968443,
      "summaries": {
        "zh-cn": {
          "text": "公牛假面讲述自己仰慕摔跤英雄的往事，发动分房走牛，以灵绳围出让灵魂正面相遇的擂台。他察觉主人公体内似乎不止一人的存在，并认出与偶像相通的灵魂，因而分心落败，醒来后仍认定主人公是自己的 My Brother。随后出现的爱丽丝将这段相遇化作模糊梦境，阎波梵陪同她离去。诺玛德把主人公带到池袋会长克劳德面前；克劳德贬低朋友牵绊、提及健吾失意的近况，激起主人公反抗，由诺玛德出手迎战。",
          "updated_at": 1790078968443
        }
      }
    },
    {
      "entry_id": "2594e1ad-8066-5043-aad3-939601bdc9b5",
      "scene": "quest_main3-8",
      "scene_file": "quest_main3-8.json",
      "created_at": 1790077145960,
      "updated_at": 1790078968443,
      "summaries": {
        "zh-cn": {
          "text": "克劳德结束试探，因主人公击败公牛假面而授予其第十名排位。受雇担任保镖的诺玛德介绍自己的侦探工作与复仇目的，透露自己原本是人类。第九位狼神神威随后担任向导，追问主人公是否愿意成为英雄，并表示自己愿作为守护英雄的刀鞘。他安排数场比赛，亲自检验主人公的资质，也说明 APP 虽会复原肉体，战斗造成的精神疲劳仍需休息恢复。",
          "updated_at": 1790078968443
        }
      }
    },
    {
      "entry_id": "ef61cb11-7df1-5788-aad6-e60f9eccd55a",
      "scene": "quest_main3-9",
      "scene_file": "quest_main3-9.json",
      "created_at": 1790077145960,
      "updated_at": 1790078968443,
      "summaries": {
        "zh-cn": {
          "text": "狼神神威用“凝结”试炼主人公，见其斩开寒气后认可英雄资质，主动认输，将第九位让出。秀一同时向志朗提出，公会人数能增强权能对现实的影响，最大的公会可能掌握改写世界的力量。主人公在照料中醒来，却拒绝为英雄之名而战，只想救回朋友。狼神神威回想英雄孤独死亡的命运，挽留未果，决定离开。主人公找到健吾，接受胜者可要求败者实现愿望的约战，但须先提高排名；波鲁克斯和巴钦主动提供训练。",
          "updated_at": 1790078968443
        }
      }
    },
    {
      "entry_id": "c9a71dae-16e7-5053-8717-82b7506d0d0f",
      "scene": "quest_main3-10",
      "scene_file": "quest_main3-10.json",
      "created_at": 1790077145960,
      "updated_at": 1790078968443,
      "summaries": {
        "zh-cn": {
          "text": "训练后，主人公归还少年郁利遗失的护身符。郁利为还人情，警告主人公与健吾都被“钓上钩”，快速上升的排名并非全凭实力。秀一也向志朗说明，有人通过收买与假赛抬高目标，再夺取奖金、威胁亲友，使目标孤立衰弱；志朗在新宿遇袭，正是用来逼迫健吾的一环。主人公仍要救回健吾，误入第一位虎人的专用更衣室，遭饥渴失控的虎人袭击。郁利追来，以大技蛮成变为成人姿态救援。",
          "updated_at": 1790078968443
        }
      }
    },
    {
      "entry_id": "1992b82b-5a9b-5793-a7b3-1e57aa47d3c1",
      "scene": "quest_main3-11",
      "scene_file": "quest_main3-11.json",
      "created_at": 1790077145960,
      "updated_at": 1790078968443,
      "summaries": {
        "zh-cn": {
          "text": "虎人的再生能力使主人公与郁利陷入苦战，诺玛德赶到，三人协力以木天蓼令其沉睡。主人公得知狼神神威临走前曾托诺玛德照顾自己。清醒后的虎人渴望能与自己平等厮杀、相互吞食的强者，对无惧靠近的主人公产生兴趣。克劳德宣布健吾与主人公赌上排名、荣誉和奖金决战，胜者将暂升第二位，取得挑战虎人的资格。健吾仍不相信相识不久的人会为自己冒险，双方登台交手。",
          "updated_at": 1790078968443
        }
      }
    },
    {
      "entry_id": "9221eabf-48df-5c6a-8911-42538c8f8a61",
      "scene": "quest_main3-12",
      "scene_file": "quest_main3-12.json",
      "created_at": 1790077145960,
      "updated_at": 1790078968443,
      "summaries": {
        "zh-cn": {
          "text": "志朗拒绝加入贤者，选择发挥自己的情报与谈判能力保护朋友，并推断出秀一与池袋高层有交易。主人公在决斗中让健吾相信其诚意并获胜。健吾坦白，自己曾想靠奖金离开封闭的东京，却落入骗局，为保护志朗而疏远朋友；随后他独自赴约面对幕后主使鬼若。主人公按志朗的计划，用全部奖金雇用安德瓦利，以更精彩的战斗吸引巴钦，两人转而协助救出健吾。志朗决定组建公会，为朋友建立归处。",
          "updated_at": 1790078968443
        }
      }
    },
    {
      "entry_id": "e1bc5dff-09ad-5ea8-917d-e9b7bed07d25",
      "scene": "quest_main3-13",
      "scene_file": "quest_main3-13.json",
      "created_at": 1790077145960,
      "updated_at": 1790078968443,
      "summaries": {
        "zh-cn": {
          "text": "鬼若因健吾拥有亲友却自称一无所有而愤怒，坦白自己靠对世界的憎恨支撑生活。两人交战，“篡夺”与“无穷”形成无法结束的冲突，引发例外：雷电异形出现，鬼若也因力量持续灌入而失控。秀一承认这是观测实验，并解释公会排名限制了例外的范围；他称鬼若是来历不明的转光生，其力量本就属于自身。志朗据此提出契约与公会排序的解决办法。虎人与鬼若厮杀，力量被夺尽，鬼若也濒临胀裂；主人公赶到阻止，健吾须避免参战加剧冲突。",
          "updated_at": 1790078968443
        }
      }
    },
    {
      "entry_id": "af11277c-d1b5-5b96-8a23-4fcf0ef137e5",
      "scene": "quest_main3-14",
      "scene_file": "quest_main3-14.json",
      "created_at": 1790077145960,
      "updated_at": 1790078968443,
      "summaries": {
        "zh-cn": {
          "text": "主人公以离断斩开鬼若连接的力量来源，使他吐出掠夺的力量、恢复理智。主人公指出其愤恨背后是孤独，并愿意与他结为朋友。鬼若感到灵魂中熟悉的牵绊，立下再次响应召唤的誓言，因力量耗尽化光消失；虎人说明他已与主人公结缘，并非死亡。秀一惊讶于主人公能承受多重契约，志朗则坚持将其视为朋友。休息时，主人公向健吾提出将来若找到原世界便一起前往，令他重新看见走出东京的希望。雷电异形开始召出大量士兵，两人再次迎战。",
          "updated_at": 1790078968443
        }
      }
    },
    {
      "entry_id": "45172680-fddb-5de3-ad3c-8d22c18bd2e7",
      "scene": "quest_main3-15",
      "scene_file": "quest_main3-15.json",
      "created_at": 1790077145960,
      "updated_at": 1790078968443,
      "summaries": {
        "zh-cn": {
          "text": "主人公与健吾并肩作战，完成以主人公为会长的临时公会注册。戍孝和加姆赶来相助。志朗确认鬼若虽不在成员列表，已订立契约的权能排序仍被记录，计划将健吾的权能也置于离断之后，再接触例外宣告排序。健吾清开道路，却引来更强的雷击；众人拒绝让加姆牺牲，波鲁克斯及时挡住雷电。巴钦、郁利、诺玛德陆续扫清阻碍，克劳德与雪狮也介入。公牛假面用灵绳封住擂台，戍孝和加姆负责保护他，为主人公与健吾创造决战机会。",
          "updated_at": 1790078968443
        }
      }
    },
    {
      "entry_id": "872300c0-1be3-5a39-bc63-0825553ee8aa",
      "scene": "quest_main3-16",
      "scene_file": "quest_main3-16.json",
      "created_at": 1790077145960,
      "updated_at": 1790078968443,
      "summaries": {
        "zh-cn": {
          "text": "主人公与健吾击倒雷电异形，接触其身体并以亲吻手背或接吻的方式宣告排序，解除例外，使地下格斗场复原。志朗迎回健吾，三人和解；公会仍是临时注册，正式成立条件尚未解决，志朗准备向安德瓦利咨询经营事务。沙罗门解释自己此前被雪狮误伤，一直在恢复。众人与池袋战士道别返校。秀一、迪欧得到观测数据，准备关注六本木和青山；爱丽丝与阎波梵也结束行动。克劳德揭穿雪狮曾安排将鬼若捧至第三位，随后决定利用数名排位者退出造成的弱势假象，引出潜在敌人。",
          "updated_at": 1790078968443
        }
      }
    }
  ]
}
