{
  "version": 1,
  "id": "640c5e11-3461-50b9-b378-18e86a061f47",
  "storage_name": "main_story_chapter_04",
  "display_name": "主线第4章",
  "revision": 2,
  "created_at": 1790077145960,
  "updated_at": 1790079276333,
  "retention": {
    "inherit_defaults": true,
    "recent_percent": 30,
    "recent_limit": 10
  },
  "manual_descriptions": {},
  "summary": {
    "zh-cn": {
      "manual": {
        "text": "为筹建公会并学会使用圣杯，良太带主人公等人拜访青山传教士。众人见到玛丽亚救济转光生、代受病痛，也目睹公会天使以教义排斥异己。阿尔斯兰失踪、加百列遭玛纳加尔姆劫走，玛丽亚借用已故恩人身份的秘密又被揭露，公会濒临分裂。良太首次不顾他人敌意，坚定维护朋友；众人深入异界化墓地，了解玛丽亚承继恩人姓名与理想的经过，帮助玛纳加尔姆放弃以死结束执念，并救回两名干部。良太也为拯救玛丽亚唤醒圣杯的治愈能力。六本木进攻时，他试图救治独自断后的萨巴利亚，却因丰穰与业火冲突引发例外，不死者席卷陵园。主人公与良太找到萨巴利亚，使他明白自己渴望的是能阻止自己犯错的人；临时契约建立后，众人合力击倒剩余例外，以排序仪式恢复城市。阿撒兹勒揭示主人公灵魂中多个异世界放逐者的痕迹，但其来历仍未查明。良太正式加入，四人以接纳不同者为志，命名“召唤师”公会，并与青山建立友好关系。奈亚一面制造危机、一面帮助解局，他与有乐町演艺家的联系也浮出水面。",
        "updated_at": 1790079276333
      }
    }
  },
  "scenes": [
    {
      "entry_id": "cbede0aa-ffdc-5b65-b125-48129cfa5f1e",
      "scene": "quest_main4-1",
      "scene_file": "quest_main4-1.json",
      "created_at": 1790077145960,
      "updated_at": 1790079276333,
      "summaries": {
        "zh-cn": {
          "text": "放学后，主人公、志朗和健吾商议公会筹备。志朗说明，公会会长能联系 GM，这是追查 APP 与主人公来历的线索，因此要建立自己的公会。正式成立需要会长、成员和获认可的公共据点，四名用户可注册，五名才能开放全部功能；宿舍不能作为据点，校外活动场所正由志朗与安德瓦利筹备。良太愿意加入，却还不会使用杯状神器，便带众人去青山向代理会长玛丽亚请教。抵达代神山学园礼拜堂后，执勤天使强行要求搜身，给反抗的健吾刻下烙印并发动攻击。",
          "updated_at": 1790079276333
        }
      }
    },
    {
      "entry_id": "c569aef1-fed2-5d1b-9472-485f16452cc3",
      "scene": "quest_main4-2",
      "scene_file": "quest_main4-2.json",
      "created_at": 1790077145960,
      "updated_at": 1790079276333,
      "summaries": {
        "zh-cn": {
          "text": "良太举起圣杯却没能施展能力，健吾准备反击时，被礼拜堂管理人萨巴利亚制止。玛丽亚出面道歉，说明自己只是代理会长，礼拜堂兼作信徒和转光生共同生活的修道院。因曾有入侵者伪装同伴携带危险品进入，搜身规定连成员也不能例外，众人配合后获准参观。玛丽亚愿意教授良太神器的用法并带大家巡视活动，健吾却对萨巴利亚的身手产生兴趣，提出比试，对方同意以切磋作为赔礼。",
          "updated_at": 1790079276333
        }
      }
    },
    {
      "entry_id": "1c6e6b38-b839-5773-8ada-c6106f5440f2",
      "scene": "quest_main4-3",
      "scene_file": "quest_main4-3.json",
      "created_at": 1790077145960,
      "updated_at": 1790079276333,
      "summaries": {
        "zh-cn": {
          "text": "萨巴利亚不躲不挡地承受健吾攻击并认输，表示只会为执行教义而全力出拳。良太羡慕健吾敢为自己的愿望树敌，坦白自己最怕被人讨厌。公会监督者阿撒兹勒出现，透露能以神器监视青山领地；他带众人去查看赈济活动，也解释萨巴利亚担任拷问官，要求自己只遵教义动武，并承受与受刑者同等的痛苦。公园里，众人发现同学丁次也是传教士成员，正在为落单转光生做饭。队尾因食物分配发生冲突，主人公等人陪玛丽亚前去制止。",
          "updated_at": 1790079276333
        }
      }
    },
    {
      "entry_id": "3a836406-a0af-539c-b638-afe181781085",
      "scene": "quest_main4-4",
      "scene_file": "quest_main4-4.json",
      "created_at": 1790077145960,
      "updated_at": 1790079276333,
      "summaries": {
        "zh-cn": {
          "text": "众人平息赈济骚乱，发现有人煽动转光生担忧按出身和罪责遭到差别待遇。天使赶来要惩罚并驱逐参与者，玛丽亚冒着违反教义的风险否认发生混战，保住他们。随后她解释，神器承接权能，天职体现使用者的存在方式；良太依照内心愿望，终于让圣杯不断产生布丁和茶碗蒸。玛丽亚接到峰明医生求助，带众人到医院，以神器替无法麻醉的转光生承受痛苦，争取诊治时间。她休息时遭忍者绑架，主人公折返救援；玛丽亚承担植物生长的痛苦催生藤蔓，共同反击。",
          "updated_at": 1790079276333
        }
      }
    },
    {
      "entry_id": "5c66d913-ad3a-5a5e-ab40-0fd30f9c696b",
      "scene": "quest_main4-5",
      "scene_file": "quest_main4-5.json",
      "created_at": 1790077145960,
      "updated_at": 1790079276333,
      "summaries": {
        "zh-cn": {
          "text": "主人公与玛丽亚击退忍者，抓住殿后者。玛丽亚了解落单转光生被当作消耗品的处境，想放他离开，却被暗中跟踪的天使阻止。天使要将他送去拷问，并指责玛丽亚不分出身接纳成员；玛丽亚坚持青山建立时救助所有人的誓言，双方僵持。加百列受阿撒兹勒通知赶来，凭话语的力量平息冲突，邀请众人观看慰问演唱会。玛丽亚透露精神支柱阿尔斯兰已失踪。忍者仍被抓回，由萨巴利亚审讯；另一边，峰明以特务身份向忍者问话，得知他们要揭露玛丽亚的身份使公会瓦解。主人公在周边销售区结识加百列的粉丝玛纳加尔姆。",
          "updated_at": 1790079276333
        }
      }
    },
    {
      "entry_id": "5b26e666-077b-5515-8a5c-818626608d67",
      "scene": "quest_main4-6",
      "scene_file": "quest_main4-6.json",
      "created_at": 1790077145960,
      "updated_at": 1790079276333,
      "summaries": {
        "zh-cn": {
          "text": "玛纳加尔姆与主人公抢购写真集，赠送粉丝徽章。主人公和良太去后台见加百列，途中遇到能神出鬼没的 DJ 奈亚拉托提普。加百列讲述自己曾因传达启示反而引起争斗而痛苦，玛丽亚支持她成为带给人快乐的偶像，并帮助未被她照顾到的人。良太羡慕这种亲密关系，坦白自己总想与所有人交好，却觉得不是任何人的首选；主人公回应他是特别的朋友。两人再次遇到奈亚、经其指路返回会场，才得知加百列已被劫走。追出后，他们发现绑匪是玛纳加尔姆；奈亚正是鼓动他将无法克制的爱慕付诸行动的人。",
          "updated_at": 1790079276333
        }
      }
    },
    {
      "entry_id": "e9fa22f8-3be3-515e-81b6-96590abd30e7",
      "scene": "quest_main4-7",
      "scene_file": "quest_main4-7.json",
      "created_at": 1790077145960,
      "updated_at": 1790079276333,
      "summaries": {
        "zh-cn": {
          "text": "玛纳加尔姆自述因爱慕加百列而被亲卫队殴打驱赶，在奈亚诱导下决定放任冲动。奈亚以不断增加的化身阻挡众人，让他带走加百列，并留下前往青山公会起源地的线索。志朗追问玛丽亚此前去向，天使也来质问，并公布拷问所得：真正的玛丽亚早已去世，眼前的人使用了她的身份。玛丽亚承认隐瞒身份，却否认参与绑架。良太克服恐惧，指出她至今的救助不能因此被否定；主人公选择相信她，志朗据此安排脱身。众人牵手配合，良太以食前丰穰放出布丁洪流冲开包围，仍遭天使追击。",
          "updated_at": 1790079276333
        }
      }
    },
    {
      "entry_id": "b0c06b8c-1985-5649-99eb-dbfbf52bfab8",
      "scene": "quest_main4-8",
      "scene_file": "quest_main4-8.json",
      "created_at": 1790077145960,
      "updated_at": 1790079276333,
      "summaries": {
        "zh-cn": {
          "text": "奈亚将加百列与阿尔斯兰关在一起，自称只想让现实更有趣。玛丽亚带众人躲进公会藏身处，坦白自己幼时被卖到东京，后来借用已故玛丽亚的身份生活；失踪时段则是被奈亚拖住闲聊。她因权限不足无法定位两名干部，众人改按线索前往青山陵园。此处安葬了早年遭难的转光生，也是传教士立誓创会之地，正受六本木公会进逼。俄菲翁与金毛九尾交谈，发现彼此都不是绑架主谋。陵园中，志朗的魔书触发异界化，打开地下墓地；发现两名被绑者留下的痕迹后，众人决定入内。萨巴利亚赶来制裁玛丽亚，健吾独守狭窄入口，为同伴争取救人的时间。",
          "updated_at": 1790079276333
        }
      }
    },
    {
      "entry_id": "4ae8fe18-9fb3-54b0-8e92-f3ace4220535",
      "scene": "quest_main4-9",
      "scene_file": "quest_main4-9.json",
      "created_at": 1790077145960,
      "updated_at": 1790079276333,
      "summaries": {
        "zh-cn": {
          "text": "地下墓地的瘴气与低语侵蚀众人理性，主人公的离断驱散影响。玛丽亚说明，各公会以不同价值观争夺支配权，而离断可能破坏排序机制，所以主人公早已受到强者关注。奈亚拦住其他人，让玛纳加尔姆与主人公决斗。主人公和玛丽亚识破他想借败亡结束伤害爱人的冲动。玛丽亚转移两人的伤势，分享自己的过去：她被真正的玛丽亚救助并爱上对方，恩人最终耗尽财产、病逝，却违背自己奉行的禁令，托阿撒兹勒为她准备合法身份，留下爱的信件。她因此承继玛丽亚之名与理想。她以相似的孤独劝玛纳加尔姆回到同伴身边，主人公继续迎接他尚未平复的悲痛。",
          "updated_at": 1790079276333
        }
      }
    },
    {
      "entry_id": "7a0c0633-40c6-54ca-b92f-1188ddf6709a",
      "scene": "quest_main4-10",
      "scene_file": "quest_main4-10.json",
      "created_at": 1790077145960,
      "updated_at": 1790079276333,
      "summaries": {
        "zh-cn": {
          "text": "玛纳加尔姆落败后平静下来。玛丽亚告诉他，即使爱不被认可，活着并与同伴前行仍能留下改变世界的痕迹，他愿意重新成为伙伴。玛丽亚却因代受伤害濒死，担心退出 APP 会使异界入口消失，仍要众人继续救援。良太拒绝接受她的牺牲，在主人公支持下唤醒圣杯的治愈力量，救回玛丽亚，并直言她的死也会令朋友伤心。众人随后救出加百列；玛纳加尔姆道歉、承诺保持距离，加百列原谅他并要求不再重犯。阿尔斯兰也获救，宽恕绑架者，答应随众人返回地面平息冲突。",
          "updated_at": 1790079276333
        }
      }
    },
    {
      "entry_id": "3960c110-b930-5ae6-9b43-05d2b65a0bc4",
      "scene": "quest_main4-11",
      "scene_file": "quest_main4-11.json",
      "created_at": 1790077145960,
      "updated_at": 1790079276333,
      "summaries": {
        "zh-cn": {
          "text": "萨巴利亚回忆自己长期拷问罪人，却始终无法证明这种使命的意义。地面上，健吾遍体鳞伤仍守住入口，一度击中萨巴利亚；天使不顾制止围攻健吾，令萨巴利亚更怀疑所谓正义。阿尔斯兰赶到，以圣油阻止战斗，斥责教义应为生命服务。健吾认为萨巴利亚也在手下留情、等待同伴回来。阿尔斯兰愿意原谅他，他却无法原谅自己。俄菲翁率飞龙包围陵园，萨巴利亚点燃自身圣油、独自断后。良太赶去治愈他，持续施加苦痛的业火与治愈一切的丰穰冲突，触发例外，墓地中大量无生命光彩的天使随之出现。",
          "updated_at": 1790079276333
        }
      }
    },
    {
      "entry_id": "f2dc73df-69b8-589f-bb13-1759025c2b88",
      "scene": "quest_main4-12",
      "scene_file": "quest_main4-12.json",
      "created_at": 1790077145960,
      "updated_at": 1790079276333,
      "summaries": {
        "zh-cn": {
          "text": "例外使权能不断灌入萨巴利亚，他勉强维持理性，想去无人处避免伤及旁人，奈亚应声将他带走。另一具被长枪刺穿的例外不断使墓中遗骸复起，受害者也化为不死者，灾害迅速扩散；俄菲翁撤军。阿尔斯兰解释，必须切断源头，否则受害者会持续增加。良太在混乱中失散，志朗劝众人避免盲目救援。阿尔斯兰以圣油限制不死者行动，亲自冲入敌阵鼓舞天使，使溃散部队重整阵形，开始守护陵园并营救同胞。",
          "updated_at": 1790079276333
        }
      }
    },
    {
      "entry_id": "2b1c0c90-bef6-580b-9194-7a17080f87a4",
      "scene": "quest_main4-13",
      "scene_file": "quest_main4-13.json",
      "created_at": 1790077145960,
      "updated_at": 1790079276333,
      "summaries": {
        "zh-cn": {
          "text": "阿尔斯兰说明，足立区曾因例外当事人全灭、APP 异常结束而留下无法复原的废墟，众人必须及时解决危机。天使重新组织救援，也承认自己过度依赖萨巴利亚。众人找到被玛丽亚保护的良太，他正因引发灾难而自责。奈亚透露，萨巴利亚在远处独自焚烧不死者，也焚烧自己，并故意刺激良太。阿尔斯兰请求去救爱徒，奈亚却指出萨巴利亚真正需要的并非强者宽恕。主人公主动前往，由奈亚带到教堂；萨巴利亚在那里压制失控，反省自己以工具自居、将判断与责任交给他人的一生。",
          "updated_at": 1790079276333
        }
      }
    },
    {
      "entry_id": "d4d6a09f-1303-543c-a624-2562043cd210",
      "scene": "quest_main4-14",
      "scene_file": "quest_main4-14.json",
      "created_at": 1790077145960,
      "updated_at": 1790079276333,
      "summaries": {
        "zh-cn": {
          "text": "主人公在教堂迎战已解除公会束缚的萨巴利亚，以离断抵挡业火。良太在志朗和健吾掩护下赶来疗伤，主人公再次挥剑；萨巴利亚主动接受败北，明白自己寻找的是能站在犯错者一边、在自己犯错时阻止自己的人。他订立临时契约，将权能置于主人公之后，安慰良太后化光离去。阿撒兹勒指出主人公灵魂中有多个异世界放逐者的痕迹，但不知道其形成原因，只推测与游戏设计者有关。他警告这些败者的宿命可能限制主人公，主人公仍决定争取胜利，拒绝由一种价值观排斥所有不同者。阿撒兹勒随后与阿尔斯兰、奈亚合作，准备解决剩下的例外。",
          "updated_at": 1790079276333
        }
      }
    },
    {
      "entry_id": "2002871e-09d8-581e-b132-5ca67691e4ed",
      "scene": "quest_main4-15",
      "scene_file": "quest_main4-15.json",
      "created_at": 1790077145960,
      "updated_at": 1790079276333,
      "summaries": {
        "zh-cn": {
          "text": "冬治试图阻止例外，却被蒙面女演员拦住；她声称他的同伴已遭消灭，并与奈亚谈论有乐町公会追求出人意料的演出。青山方面由阿撒兹勒以显露追踪例外，组织总攻。丁次送来便当支援，天使、玛纳加尔姆、加百列、阿尔斯兰和玛丽亚先后开路、鼓舞或掩护。要解除例外，须让良太与已临时订约的萨巴利亚都位于主人公的权能之后，再接触本体宣告排序。面对不死者包围，良太决定接受奈亚的运送，与主人公直达目标，志朗和健吾留下抵挡追兵。",
          "updated_at": 1790079276333
        }
      }
    },
    {
      "entry_id": "b9ed14c3-2dbf-5b9a-b1bb-40b8df23d576",
      "scene": "quest_main4-16",
      "scene_file": "quest_main4-16.json",
      "created_at": 1790077145960,
      "updated_at": 1790079276333,
      "summaries": {
        "zh-cn": {
          "text": "良太在例外面前因恐惧动弹不得，主人公的信任使他重新站起。两人配合疗伤与进攻，主人公在良太呼喊中击倒例外，随后通过亲吻手背或接吻宣告排序，使青山与涩谷恢复原状。良太坦白自己一直害怕被朋友疏远，如今即使会被别人讨厌，也想与主人公并肩前行。玛丽亚说明据点争夺只在放学后至天黑进行，眼下六本木不会再进攻。双方约定保持友好。良太加入后，四人成员数解锁新的公会功能，众人按来者不拒的信念，将公会命名为“召唤师”。玛丽亚与他们告别，留下重整青山公会。",
          "updated_at": 1790079276333
        }
      }
    }
  ]
}
