{
  "version": 1,
  "id": "e1ff4d7b-46c0-4757-bf73-1fc733bd40d7",
  "storage_name": "context_2",
  "display_name": "圣夜中闪耀的黑帮分子",
  "created_at": 1792859190135,
  "retention": {
    "inherit_defaults": true,
    "recent_percent": 30,
    "recent_limit": 10
  },
  "manual_descriptions": {},
  "summary": {},
  "scenes": [
    {
      "entry_id": "4c19e462-d50f-45a9-a0ec-17d7e7e0e743",
      "scene": "xmas2022_0-1",
      "scene_file": "xmas2022_0-1.json",
      "created_at": 1792859241935,
      "updated_at": 1792859610011,
      "summaries": {
        "zh-cn": {
          "text": "圣诞节当天，东京突降罕见大雪。见习圣诞老人尤尔与寻找健太的巴杰斯特搜寻整夜，却未发现任何孩子的踪影。另一边，在神宿学园召唤师据点中，众人正筹备圣诞派对，但主人公与良太外出未归。阿形与哈奴曼主动出门去取蛋糕，途中偶遇自称主人公兄长的伏羲，并获赠雨伞。二人继续前行时，街头的大屏幕正播报东京圣诞老人学校发生挟持事件的新闻。",
          "updated_at": 1792859610011
        }
      }
    },
    {
      "entry_id": "c8a855d3-5cec-4ff2-bbf7-78a849496429",
      "scene": "xmas2022_0-2",
      "scene_file": "xmas2022_0-2.json",
      "created_at": 1792859409731,
      "updated_at": 1792859896904,
      "summaries": {
        "zh-cn": {
          "text": "巴特罗在学院思索圣诞老人相关的过往，并在收到求助后与马尔杜克一同离开。另一边，东京圣诞老人学校内，见习圣诞老人尤尔正向校长杰得汇报荒川区儿童失踪导致礼物无法送达一事，主人公、良太和前来采访的祝融也在现场。此时，一群黑衣人持枪闯入并将众人挟持。隐蔽在房间内的堤达与克鲁波克鲁目睹了这一幕，原来克鲁波克鲁在平安夜用蜂斗菜叶保护荒川区儿童避寒，导致圣诞老人找不到他们；二人本想潜入学校借用圣诞老人的口袋补偿孩子们，却意外撞上黑衣人袭击。正当二人观察局势时，又有人影走入了校长室。",
          "updated_at": 1792859896904
        }
      }
    },
    {
      "entry_id": "20087a07-f8b9-408a-b29e-883fe5dcb039",
      "scene": "xmas2022_1-1",
      "scene_file": "xmas2022_1-1.json",
      "created_at": 1792859560675,
      "updated_at": 1792860011314,
      "summaries": {
        "zh-cn": {
          "text": "黑衣人以祝融为人质制伏了主人公等人。被称为“首领”的男子现身并要求杰得交出神器圣诞布袋，杰得为保护孩子们的安全只得妥协，袭击者得手后离去。手力男与大口真神随后赶到记录口供，良太决定留下协助警方调查，派对因而推迟。主人公在校门前遇到巴特罗，得知其通过精密推算认为祝融是自愿跟随黑衣人离开的。与此同时，伏羲正与巴特罗进行纸牌博弈并交谈过去的因缘与立场；另一黑手党派系皮特家族得知布袋被西木鲁格家族夺走，决定武力铲除对手。",
          "updated_at": 1792860011314
        }
      }
    },
    {
      "entry_id": "88a8c349-4a6c-4aff-b6f5-e0a02ae24bb8",
      "scene": "xmas2022_1-2",
      "scene_file": "xmas2022_1-2.json",
      "created_at": 1792859560904,
      "updated_at": 1792860153726,
      "summaries": {
        "zh-cn": {
          "text": "主人公回到房间后与巴特罗通电话，巴特罗告知了袭击圣诞老人学校并带走祝融的人正是荒川区黑手党西摩格家族的首领西摩格，并答应明天陪同主人公前往荒川区调查。另一边，祝融在梦中与栖宿在体内的另一个“祝融”相见，二人冰释前嫌并合影留念。醒来后，身在西摩格据点的祝融质问西摩格为何强行抢夺圣诞袋，西摩格以现实理由说服了他，并赠送他一套能融入黑手党家族的新服装；西摩格随后露出了深信自身为“恶”之人才有的险恶笑容。",
          "updated_at": 1792860153726
        }
      }
    },
    {
      "entry_id": "e1fc935e-c2df-42c8-a274-9be26fc89a49",
      "scene": "xmas2022_2-1",
      "scene_file": "xmas2022_2-1.json",
      "created_at": 1792859561300,
      "updated_at": 1792860285099,
      "summaries": {
        "zh-cn": {
          "text": "在东京赌场的贵宾室里，西摩格家族的首领西摩格与伏羲对弈轮盘赌。伏羲以赞助西摩格家族活动资金为条件，请求西摩格在主人公到来时撮合自己与“妹妹”（主人公）。西摩格答应了交易，并率众轻松击退了来犯的敌对黑手党。与此同时，在中迦野艺能学园，堤达与克鲁波克鲁为弥补被破坏的圣诞送礼计划，召集了弁天、赫尔墨斯与自来也，决定举办慈善演出筹款买礼物，并从赫尔墨斯口中得知抢走袋子的是西摩格家族。而在西摩格的据点中，伏羲、西摩格、祝融与保镖奥德尔交谈时，伤痕累累的巴杰斯特慌忙冲入报告健太遇袭。得知事态恶化的伏羲脸色骤变，为了保护妹妹急忙动身赶往贫民窟。",
          "updated_at": 1792860285099
        }
      }
    },
    {
      "entry_id": "161add9c-7337-43e5-9fc0-7210e553cee3",
      "scene": "xmas2022_2-2",
      "scene_file": "xmas2022_2-2.json",
      "created_at": 1792859559954,
      "updated_at": 1792860307284,
      "summaries": {
        "zh-cn": {
          "text": "堤达回想起在龙宫世界时，曾有一名拒绝接受自己宠爱的巫子最终消失在深渊的往事。现实中，装扮成圣诞老人的堤达与克鲁波克鲁因送礼物受挫，偶遇了正与巴特罗同行的主人公。此时伏羲也赶来保护“妹妹”（主人公），各方因争夺主人公的关注而在封闭领域内大打出手。最终巴特罗与克鲁波克鲁联手瓦解了堤达暴走的攻势，而主人公为了保护堤达挺身挡下冰柱。冷静下来的众人在主人公的调解下言归于好，决定共同前往黑帮头目唐·西木鲁格的所在地。",
          "updated_at": 1792860307284
        }
      }
    },
    {
      "entry_id": "ffc9e7ec-12ac-4da8-9ec4-677fd1e0ec92",
      "scene": "xmas2022_3-1",
      "scene_file": "xmas2022_3-1.json",
      "created_at": 1792859561120,
      "updated_at": 1792860317774,
      "summaries": {
        "zh-cn": {
          "text": "在伏羲的带领下，主人公一行来到了西摩格家族的藏身处，见到了西摩格、巴杰斯特以及奥德尔。祝融开心地跑出来迎接主人公。关于如何补办错过的圣诞节，众人的讨论逐渐聚焦到失去信仰之力的圣诞布袋上。西摩格与奥德尔道出了抢夺圣诞布袋的真正原因：为了做诱饵引出飘忽不定的敌对组织“皮特家族”。面对西摩格展现出的冷酷黑帮作风，祝融大受打击并哭着跑了出去。主人公等人追上祝融，祝融坦白自己感受到了西摩格内心的寂寞与温柔，但担心自己成了对方的累赘。为了让哭泣的祝融重新打起精神，堤达、巴特罗和克鲁波克鲁挑起了打雪仗，雪地里渐渐重新响起了孩子们的欢笑声。",
          "updated_at": 1792860317774
        }
      }
    },
    {
      "entry_id": "85e3b6f0-d2d5-47b0-acb0-58ea8a6ffa19",
      "scene": "xmas2022_3-2",
      "scene_file": "xmas2022_3-2.json",
      "created_at": 1792859560449,
      "updated_at": 1792860491783,
      "summaries": {
        "zh-cn": {
          "text": "面对荒川区饥寒交迫的混混与流离失所的民众，伏羲与西摩格在祝融离开后决定设法调整计划接纳众人。此时，巴特罗与众人在雪地堆雪人，并遇到了因无法满足孩子们对圣诞礼物的期待而发愁的布袋。巴特罗提出在荒川区重现圣诞节，发动众人搜集废弃物作为装饰，并向西摩格与伏羲借调道具，甚至用“绝地反击”的言辞拉拢街头小混混协助。在众人齐心协力下，整条街道被装扮一新，西摩格也换上圣诞老人装与祝融解开误会合影。然而，圣诞布袋仍未产生反应，巴特罗以为是身为“冷冰冰计算器”的自己阻碍了圣诞信仰，企图悄然离去，却收到了孩子们真诚的感谢。在主人公的陪伴与开导下，巴特罗感受到了友情的温暖，并如释重负地露出了属于“人类”的笑容。",
          "updated_at": 1792860491783
        }
      }
    },
    {
      "entry_id": "40cc52e4-cfd7-48af-8c70-3b984eccc084",
      "scene": "xmas2022_4-1",
      "scene_file": "xmas2022_4-1.json",
      "created_at": 1792859561994,
      "updated_at": 1792860499590,
      "summaries": {
        "zh-cn": {
          "text": "皮特家族蓄谋袭击西摩格家族，赫尔墨斯抓获了企图绑架贫民窟儿童的侦察兵并交给西摩格。在据点外，弁天与赫尔墨斯通过街头演奏将全区的孩子们聚集到安全地带。西摩格家族与皮特家族的大规模抗争爆发，伏羲和巴特罗主动奔赴前线，要求主人公留在后方，但主人公决定与西摩格同行并保护他。战场上，西摩格用治愈神羽支援部下并劝降敌军，然而在背过身时，却遭到信任的腹心开枪背叛。腹心向全员谎称唐遭到了外来者袭击。",
          "updated_at": 1792860499590
        }
      }
    },
    {
      "entry_id": "bb6cb199-33e2-48c2-90e5-2c4d59c14b8c",
      "scene": "xmas2022_4-2",
      "scene_file": "xmas2022_4-2.json",
      "created_at": 1792859562145,
      "updated_at": 1792860517390,
      "summaries": {
        "zh-cn": {
          "text": "巴特罗讲述了自己最初捡回收养流浪猫并最终建立皮特家族的缘由。回到圣诞节装饰刚完成不久的过去，巴特罗借口休息来到祝融所在的房间，悄悄解除了祝融相机神器上的限制装置。与此同时，伏羲现身与堤达对峙，并借助祝融相机抽走生命力权能削弱了堤达。两人在激战中互相试探，伏羲以玩笑般的口吻点破堤达对主人公的执着，堤达则反唇相讥指出伏羲因害怕不被爱而患得患失。此时传来西摩格中枪且主人公被指为凶手的通报，两人决定兵分两路前去救援。场景再次闪回到数刻前，巴特罗在对相机动手脚时与伏羲打赌今夜天气，布下了算计的伏笔。",
          "updated_at": 1792860517390
        }
      }
    },
    {
      "entry_id": "675722d9-2a4b-48ae-99c7-1943f98d551e",
      "scene": "xmas2022_5-1",
      "scene_file": "xmas2022_5-1.json",
      "created_at": 1792859560122,
      "updated_at": 1792860527076,
      "summaries": {
        "zh-cn": {
          "text": "重伤的西摩格向主人公吐露了自己因过去痛失亲人、渴求家人而建立黑帮的过往，即便遭遇背叛也无法对“家人”产生恨意。敌对黑手党追兵杀到，主人公拼死掩护西摩格。另一边，得知西摩格中枪且主人公被诬陷的祝融，在堤达的相助下冲出据点，二人乘着虹色飞鸟在空中搜寻。地面上，克鲁波克鲁击败了巴特罗，而陷入重围的主人公得到了伏羲的及时救援。伏羲指出如今的战局是两位未来预测者干涉的结果，シームルグ已回天乏术。空中目睹惨状的祝融一度陷入绝望，但在堤达的激励以及体内另一个“祝融”的共鸣鼓励下重拾勇气。祝融借助神器将街区映出极光，唤起奇迹，虹色鸟群带着圣诞礼物飞向全城。",
          "updated_at": 1792860527076
        }
      }
    },
    {
      "entry_id": "ca63767a-e54d-4bad-9487-66d7759eac5c",
      "scene": "xmas2022_5-2",
      "scene_file": "xmas2022_5-2.json",
      "created_at": 1792859561801,
      "updated_at": 1792860537442,
      "summaries": {
        "zh-cn": {
          "text": "那是圣诞当夜过去后的一幕。皮特家族的首领巴特罗引导穷困潦倒的流浪猫成员们，并向他们询问是否相信圣诞老人。回到惨烈战场的当下，重伤濒死的巴特罗被部下发现，此时夜空突然亮起绚烂的极光。祝融与堤达乘着虹色飞鸟将承载心愿的礼物送往街区各处，抚平了所有人的心灵。飞鸟的神羽治愈了濒死的西摩格与巴特罗。巴特罗以皮特家族首领的身份现身向西摩格宣战，但目睹首领濒死惨状的部下们纷纷放下武器拒绝再战。西摩格借此机会接纳皮特家族并原谅了腹心，宣布两个家族合并为真正的“家人”。最终，两帮人冰释前嫌，与贫民窟的孩子们一起在街头举办盛大的圣诞宴会，共同庆祝圣诞节。",
          "updated_at": 1792860537442
        }
      }
    },
    {
      "entry_id": "624b6aae-6163-48b2-b8d1-ce3b65ced50b",
      "scene": "xmas2022_6",
      "scene_file": "xmas2022_6.json",
      "created_at": 1792861335717,
      "updated_at": 1792861380668,
      "summaries": {
        "zh-cn": {
          "text": "圣诞派对在西摩格家族秘密基地前热闹举行。克鲁波克鲁向主人公表达感谢，并提示今后若有伤害儿童者必不轻饶；堤达缠着主人公索要喂食蛋糕，却被伏羲暗中调换成崇拜堤达的黑衣人，随后伏羲向主人公表达了对“不可预测的你”的钟爱并告辞；巴特罗与艾萨克交谈后，对夏之门的追寻与义体改造的牺牲释然，决定回归公会；西摩格在屋内独饮，向主人公倾诉建立家族的不易与未来期许；祝融在街角徘徊后，决定向西摩格说明自己将回归学校生活，西摩格欣慰接纳并承诺此地永远是祝融的家。两家族成员与孩子们融洽共度圣夜，奇迹与新的羁绊在这座城市中诞生。",
          "updated_at": 1792861380668
        }
      }
    },
    {
      "entry_id": "a4f80ad2-01cb-43c4-8871-5c58b342c219",
      "scene": "xmas2022_special_zhurong",
      "scene_file": "xmas2022_special_zhurong.json",
      "created_at": 1792859560290,
      "updated_at": 1792861515509,
      "summaries": {
        "zh-cn": {
          "text": "祝融在圣诞夜前夕从睡梦中醒来，换上圣诞老人装与主人公在校门前会合。两人一同前往料理教室，亲手制作了白色树干蛋糕并合影留念。回到学园宿舍后，两人品尝了炸鸡大餐、分食蛋糕，祝融还借来放映机与主人公并肩观赏电影。倚在主人公肩头的祝融坦露了自己对主人公的依恋与喜爱，并约定以后也要一直在一起，最终在主人公身旁安然入睡。",
          "updated_at": 1792861515509
        }
      }
    },
    {
      "entry_id": "f5f37a52-cf92-474b-b324-eee80fa39a32",
      "scene": "xmas2022_special_fuxi",
      "scene_file": "xmas2022_special_fuxi.json",
      "created_at": 1792859560782,
      "updated_at": 1792861403263,
      "summaries": {
        "zh-cn": {
          "text": "圣诞节后的某天早晨，主人公在门前发现一个巨大的礼物盒，打开后发现竟是装扮成圣诞老人的伏羲。伏羲坚称自己是来当“理想哥哥”并实现妹妹愿望的，热情地拿出豪华五段便当亲手喂主人公吃，并在谈话中表达了对主人公的极度宠溺和对其他“兄弟”角色的嫉妒。伏羲反省后表示愿意听从主人公的任性要求，主人公便为他进行了按摩。随后伏羲骑着摩托车带主人公兜风，两人在寒风中共享围巾并温情交谈，伏羲提出陪睡到主人公入眠。然而第二天清晨伏羲离去后，主人公再次在门外发现了一个眼熟的巨大礼物盒，意识到这位哥哥的宠溺攻势还将继续。",
          "updated_at": 1792861403263
        }
      }
    },
    {
      "entry_id": "c03a9145-f5d8-4041-ad66-3957821d9d89",
      "scene": "xmas2022_special_simurgh",
      "scene_file": "xmas2022_special_simurgh.json",
      "created_at": 1793077275651,
      "updated_at": 1793077275651,
      "summaries": {}
    },
    {
      "entry_id": "a554a3c7-f538-4485-b3d7-387cf201c448",
      "scene": "xmas2022_special_bertro",
      "scene_file": "xmas2022_special_bertro.json",
      "created_at": 1793077275805,
      "updated_at": 1793083545884,
      "summaries": {
        "zh-cn": {
          "text": "圣诞夜后，主人公与巴特罗一同在卡拉OK和电影院约会度过悠闲时光。巴特罗回顾起自己过去追求预测未来、甚至渴望成为机械的心路历程，但在经历了与主人公及伙伴们的这起事件后，他发现自己未能算尽一切的结局，并开始重新思索自己与“人类”的界限。随后两人来到主人公的房间，巴特罗依照古老习俗提议绑住手脚同床共枕，两人在漆黑中倾听彼此的心跳与情感，巴特罗承诺若未来再度相逢，定会赠予主人公一份礼物。",
          "updated_at": 1793083545884
        }
      }
    },
    {
      "entry_id": "8b74889f-12ad-4c85-a53e-357728e653fc",
      "scene": "xmas2022_special_teda",
      "scene_file": "xmas2022_special_teda.json",
      "created_at": 1793077275929,
      "updated_at": 1793077275929,
      "summaries": {}
    }
  ],
  "revision": 23,
  "updated_at": 1793083545884,
  "internal_terms": {
    "zh-cn": {}
  }
}
